"2012/03834/TREE","21/11/2012","47 Cloncurry Street London SW6 6DT","Front garden - remove Cherry tree","Application Approved",""
"2012/03848/NMAT","15/11/2012","Flat A First Floor 45 Haldane Road London SW6 7ET","Non-Material Minor Amendment to Planning Permission 2011/02511/FUL granted on 19 October 2011 for th...","Application Approved",""
"2012/03706/TREE","14/11/2012","17 Applegarth Road London W14 0HY","Rear garden - remove mature Ailanthus altissima","Pending Decision",""
"2012/03678/TREE","08/11/2012","199 Hammersmith Grove London W6 0NP","Rear of premises. Evergreen privet, reduce crown by 32%.","Application Approved",""
"2012/03645/TREE","08/11/2012","Flat 4 Albion House 39 St Peter's Square London W6 9NN","Front garden. Robinia psuedoacacia, pollard (5 day notice; dead or dying tree)","Application Approved",""
"2012/03628/TREE","07/11/2012","25 Bowerdean Street London SW6 3TN","Front garden. Lawsons Cypress, trim by around 30%. Rear garden. Pittosporum, trim by around 30%.","Application Approved",""
"2012/03561/TREE","01/11/2012","24 Racton Road London SW6 1LP","Rear garden. Quince (ID 1), reduce crown height and spread by approximately 1-1.5 metres to renovate...","Application Approved",""
"2012/03629/NMAT","31/10/2012","19 Palace Mansions Earsby Street London W14 8QW","Non-Material Amendment to Planning Permission 2012/02015/FUL granted on 6 August 2012 for the insta...","Application Approved",""
"2012/03537/TREE","30/10/2012","19 Hurlingham Gardens London SW6 3PH","Rear garden. Cypress, tidy up snags; reduce height by up to 2 metres and reshape into a rounded crow...","Application Approved",""
"2012/03536/TREE","30/10/2012","17 Hurlingham Gardens London SW6 3PH","Rear garden. Prunus, reduce height by 1.5 - 2 metres; reduce laterals by up to 1.5 metres to reshape...","Application Approved",""
"2012/03531/TREE","30/10/2012","Hurlingham Club Ranelagh Gardens London SW6 3PR","Sycamore in Play Area - Crown lift by removal of 1 x low limb and reduction of limb over play area P...","Application Approved",""
"2012/03528/TREE","30/10/2012","79 Inglethorpe Street London SW6 6NU","Rear Garden. Purple Plum and Box Elder, fell as close to current ground level as possible, treat stu...","Application Approved",""
"2012/03527/TREE","30/10/2012","19 Girdlers Road London W14 0PS","Front garden. Limes (2), secondary pollard back to previous pruning points by reducing laterals by u...","Application Approved",""
"2012/03526/TREE","30/10/2012","17 Girdlers Road London W14 0PS","Front garden. 1) Silver birches (four), prune. 2) Silver birches (two), install larger tree stakes t...","Application Approved",""
"2012/03550/OBS","26/10/2012","Energy Recovery Centre Channel Gate Road London","Construction of an energy recovery centre comprising a single purpose designed building to provide a...","No Objection to Proposal  (OBS only)",""
"2012/03840/TREE","25/10/2012","BBC Television Centre Wood Lane London W12 7RJ","BBC Television Centre. 2 trees, fell. 14 trees, prune (see schedule or works)","Application Approved",""
"2012/03547/NMAT","25/10/2012","19 Bettridge Road London SW6 3QH","Non-material minor amendment to Planning Permission 2012/01741FUL granted 16th July 2012 for the ere...","Application Approved",""
"2012/03517/CLP","24/10/2012","71 Primula Street London W12 0RF","Use of part of the first floor level for a private chauffeur service, on the basis that: (i) No othe...","Application Approved",""
"2012/03456/CLP","24/10/2012","33 Carthew Road London W6 0DU","Erection of a single storey rear extension, to the side of the existing back addition.","Application Withdrawn",""
"2012/03441/CLP","23/10/2012","8 Flanchford Road London W12 9ND","Installation of a flue to the rear elevation.","Application Approved",""
"2012/03474/NMAT","19/10/2012","10 Quarrendon Street London SW6 3SU","Non-material minor amendment to Planning Permission 2011/02472/FUL granted 27 September 2011 for the...","Application Refused",""
"2012/03428/FUL","19/10/2012","St Pauls Girls School Brook Green London W6 7BS","Installation of handrails outside the front entrance.","Application Approved",""
"2012/03427/LBC","19/10/2012","St Pauls Girls School Brook Green London W6 7BS","Installation of handrails inside and outside the front entrance.","Application Approved",""
"2012/03435/TREE","18/10/2012","4 Sinclair Road London W14 0NH","Rear garden. 2 London Plane trees, 30% reduction away from building.","Application Lapsed (No Further Action)",""
"2012/03431/TREE","18/10/2012","2 Sinclair Road London W14 0NH","Rear garden. London Plane, 30% reduction away from building.","Application Lapsed (No Further Action)",""
"2012/03416/ADV","18/10/2012","121 - 123 Askew Road London W12 9AU","Display of internally illuminated fascia signs fronting Askew Road and Laurence Mews; display of an ...","Application Approved",""
"2012/03385/FUL","18/10/2012","98B Townmead Road London SW6 2SG","Minor amendments to previously approved application 2012/01789/FUL for the Erection of a rear roof e...","Application Approved",""
"2012/03383/CLP","18/10/2012","4 Knivett Road London SW6 1JH","Internal alterations to basement flat to facillitate conversion into a single dwelling house.","Application Approved",""
"2012/03378/TREE","18/10/2012","7 Hestercombe Avenue London SW6 5LL","Rear Garden - Beech - Crown reduce back to previous reduction points","Application Lapsed (No Further Action)",""
"2012/03376/FUL","18/10/2012","27 Cardross Street London W6 0DP","Retention of a part two storey, part one storey rear extension at ground and first floor levels (ame...","Application Approved",""
"2012/03510/TREE","17/10/2012","Linden House 60 Upper Mall London W6 9TA","Boatyard 1) Sycamores (3), fell to ground by sectional takedown. Front left corner 2) Sycamore, redu...","Application Lapsed (No Further Action)",""
"2012/03464/TREE","17/10/2012","596 King's Road London SW6 2DX","Rear. 1) Pear, reduce and re-shape crown all round 20 - 25%; prune back low stem by 50% to new growi...","Application Lapsed (No Further Action)",""
"2012/03462/TREE","17/10/2012","20A Caithness Road London W14 0JA","Rear garden. Ash, re-pollard to main trunk knuckles/previous pollard points; clean out lower crown a...","Application Lapsed (No Further Action)",""
"2012/03423/NMAT","17/10/2012","55 Campana Road London SW6 4AT","Non-Material Minor Amendment to Planning Permission 2012/00192/FUL granted on 15 March 2012 for the ...","Application Approved",""
"2012/03367/TREE","17/10/2012","37 Sinclair Road London W14 0NS","Rear  - Lime #1 adj. to boundary with No 35 - Reduce crown by approx 3-4m Lime #2 adj boundary with ...","Application Lapsed (No Further Action)",""
"2012/03366/TREE","17/10/2012","35 Sinclair Road London W14 0NS","Rear garden - basement flat   Lime - reduce crown by approx 3-4m from height; strip Ivy from crown b...","Application Lapsed (No Further Action)",""
"2012/03364/FUL","17/10/2012","4 Rowan Terrace London W6 7DZ","Erection of a single storey rear extension, to the side and rear of the existing back addition, foll...","Application Approved",""
"2012/03359/TREE","17/10/2012","17 Rylett Road London W12 9SS","1- Mulberry- Remove dead branches. Reduce remainder of tree by 2ft (back to growth points). 2- Bay T...","Application Lapsed (No Further Action)",""
"2012/03351/FUL","17/10/2012","11 Munster Road London SW6 4ER","Erection of a single storey rear extension, to the side and rear of the existing back addition.","Application Approved",""
"2012/03346/CLE","17/10/2012","71 Anselm Road London SW6 1LH","Use of the flat roof to the rear at first floor level as a terrace.","Application Approved",""
"2012/03404/CLP","16/10/2012","2 Grove Mews London W6 7HS","Alterations to windows at ground and first floor levels to front and rear elevations; installation o...","Application Refused",""
"2012/03393/FUL","16/10/2012","13 And 15 Orbain Road London SW6 7JZ","Extensions and alterations to both at 13 and 15 Orbain Road including: erection of rear roof extensi...","Application Approved",""
"2012/03390/FUL","16/10/2012","45 Breer Street London SW6 3HE","Erection of a rear roof extension, including installation of 2 rooflights into front roof slope ; er...","Application Approved",""
"2012/03342/TEL56","16/10/2012","O/S 105 Glenthorne Road London W6 0LJ","Installation of BT Broadband cabinet.","Application Approved",""
"2012/03341/ADV","16/10/2012","109 King Street London W6 9JG","Retention of an internally illuminated fascia sign and internally illuminated projecting sign.","Application Approved",""
"2012/03339/FUL","16/10/2012","24 Wormholt Road London W12 0LS","Erection of a rear roof extension; erection of a rear extension over part of the existing back addit...","Application Approved",""
"2012/03338/FUL","16/10/2012","22 Wormholt Road London W12 0LS","Erection of a rear roof extension; erection of a rear extension over part of the existing back addit...","Application Approved",""
"2012/03337/FUL","16/10/2012","24 Beltran Road London SW6 3AJ","Replacement of french doors in existing rear roof extension with dormer window; erection of single s...","Application Approved",""
"2012/03333/TREE","16/10/2012","10 Finlay Street London SW6 6HD","Rear garden. T2) Magnolia, thin crown by 15%. T3) Hawthorn, reduce back to previous points of reduct...","Application Lapsed (No Further Action)",""
"2012/03332/FUL","16/10/2012","38 Gilstead Road London SW6 2LG","Erection of a single storey rear extension, to the side and rear of the existing back addition.","Application Approved",""
"2012/03330/FUL","16/10/2012","Charing Cross Hospital Fulham Palace Road London W6 8RF","Retention of 1x 300mm microwave dish to existing installation at roof level.","Application Approved",""
"2012/03412/NMAT","15/10/2012","1 Ravenscourt Place London W6 0UN","Non-Material Minor Amendment to Planning Permission 2012/02042/FUL granted on 21 September 2012 for ...","Application Approved",""
"2012/03379/NMAT","15/10/2012","405 - 409 King Street London W6 9NQ","Non-Material Minor Amendment to Planning Permission 2011/01239/FUL granted 21st February 2012 for th...","Application Approved",""
"2012/03372/TPO","15/10/2012","19-21 Inglethorpe Street London SW6 6NS","Pruning of 1 x Silver Birch Tree in front garden, subject to Tree Preservation Order TPO/172/3/91 (T...","Application Approved",""
"2012/03322/FUL","15/10/2012","6 Binden Road London W12 9RJ","Erection of a single storey rear extension, to the side of the existing back addition; formation of ...","Application Approved",""
"2012/03320/FUL","15/10/2012","Flat Ground Floor 46 Mendora Road London SW6 7NB","Erection of a single storey rear extension, to the side of the existing back addition, including ins...","Application Approved",""
"2012/03318/FUL","15/10/2012","80 Shorrolds Road London SW6 7TX","Erection of a single storey rear extension, to the side of the existing back addition, including reb...","Application Approved",""
"2012/03316/TREE","14/10/2012","17 Lord Napier Place London W6 9UB","Cherry tree - only tree in garden. Has serious canker so needs 50% pruning to maintain safety","Application Lapsed (No Further Action)",""
"2012/03355/ADV","12/10/2012","Bank Buildings Fulham Broadway London SW6 1EP","Display of 3 x internally illuminated suspended fascia signs, 1 x internally illuminated projecting ...","Application Approved",""
"2012/03354/CLP","12/10/2012","34 Kingwood Road London SW6 6SR","Erection of a rear extension at second floor level, on top of existing back addition.","Application Refused",""
"2012/03313/FUL","12/10/2012","22 Tunis Road London W12 7EZ","Erection of a rear mansard roof extension with rear dormer and replacement of existing single storey...","Application Approved",""
"2012/03300/FUL","12/10/2012","8 Avalon Road London SW6 2EX","Enlargement of existing rear lightwell including installation of replacement doors to rear elevation...","Application Approved",""
"2012/03299/CLP","12/10/2012","11 Warbeck Road London W12 8NS","Erection of a rear dormer window at third floor level; installation of 1 x rooflight in the front ro...","Application Approved",""
"2012/03356/NMAT","11/10/2012","664 - 666 Fulham Road London SW6 5RX","Non-material minor amendment to Planning Permission 2010/00134/FUL granted at appeal (APP/H5390/A/10...","Application Approved",""
"2012/03347/FUL","11/10/2012","48 Rosaville Road London SW6 7BL","Erection of a rear extension at second floor level over part of the existing back addition; replacem...","Application Approved",""
"2012/03297/TREE","11/10/2012","The London Apollo  Queen Caroline Street London W6 9QH","Sycamore (T1) crown reduce by 20% approx 2m of the leafed crown and deadwood.","Application Lapsed (No Further Action)",""
"2012/03287/TREE","11/10/2012","1 Kempson Road London SW6 4PX","Front Garden - Sycamore - Fell to ground level and poison stump.","Application Approved",""
"2012/03286/TREE","11/10/2012","Water Treatment Facility 46 Chancellors Road London W6 9RS","T1 Maple - reduce and reshape crown by 20%. T2 Leyland Cypress - 30% reduce, crown lift from fence a...","Application Lapsed (No Further Action)",""
"2012/03282/FUL","10/10/2012","22 Beltran Road London SW6 3AJ","Erection of a rear extension at first floor level over part of the existing back addition.","Application Approved",""
"2012/03281/DET","10/10/2012","Grove House 27 Hammersmith Grove London W6 0NE","Submission of details of anti-vibration measures pursuant to condition 4 of planning permission ref:...","Application Approved",""
"2012/03277/FUL","10/10/2012","10 Keith Grove London W12 9EZ","Erection of an additional floor at roof level over part of the existing flat roof; reinstatement of ...","Application Approved",""
"2012/03276/FUL","10/10/2012","10 Keith Grove London W12 9EZ","Erection of an additional floor at roof level; reinstatement of parapet wall at roof level to front ...","Application Refused",""
"2012/03274/TREE","10/10/2012","47 Wandsworth Bridge Road London SW6 2TB","Lime (located in the rear Garden, against the back wall and boundary of 47 Wandsworth Bridge Road). ...","Application Lapsed (No Further Action)",""
"2012/03271/FUL","10/10/2012","45 Baron's Court Road London W14 9DZ","Installation of 1 x rooflight in the front roofslope; installation of 1 x rooflight in the flat roof...","Application Approved",""
"2012/03294/FUL","09/10/2012","30 And 32 New King's Road London SW6 4ST","Replacement of existing windows on front elevations at first floor and roof level with timber frame ...","Application Approved",""
"2012/03290/EFUL","09/10/2012","18 Fulham Park Gardens London SW6 4JX","Renewal of planning permission 2009/02178/FUL granted on 26 October 2009 for the erection of a singl...","Application Approved",""
"2012/03285/NMAT","09/10/2012","Imperial Wharf Townmead Road London","Non-Material Amendment to Planning Permission 2010/02484/VAR granted 23 June 2011 for the amendment ...","Application Approved",""
"2012/03266/CLP","09/10/2012","6 Caverswall Street London W12 0HG","Erection of a rear roof extension including the formation of a hip to gable roof extension;  erectio...","Application Approved",""
"2012/03264/TREE","09/10/2012","26 Carthew Road London W6 0DX","T1: Magonolia in rear garden Crown reduce to reshape removint 15-20% upto approximately 1m","Application Lapsed (No Further Action)",""
"2012/03257/FUL","09/10/2012","8 Claridge Court Munster Road London SW6 4EY","Erection of a dormer window on the existing rear roof slope.","Application Approved",""
"2012/03307/NMAT","08/10/2012","40 Finlay Street London SW6 6HD","Non-material minor amendment to Planning Permission 2011/03092/FUL granted 28 November 2011 for erec...","Application Withdrawn",""
"2012/03270/DET","08/10/2012","55 Purser's Cross Road London SW6 4QY","Submission of details of screening pursuant to Condition 4 of planning permission ref. 2012/01965/FU...","Application Approved",""
"2012/03253/CLP","08/10/2012","18 And 26 Adam Walk London SW6 6LE","Conversion of 1 x 2 bedroom flat and 1 x 1 bedroom flat (18 and 26 Adam Walk) into a single dwelling...","Application Approved",""
"2012/03251/TREE","08/10/2012","9 Moore Park Road London SW6 2JB","Rear garden  - remove conifer tree","Application Approved",""
"2012/03250/CLP","08/10/2012","64 Godolphin Road London W12 8JW","Erection of a rear roof extension; installation of 2 x rooflights in the front roofslope; erection o...","Application Approved",""
"2012/03249/FUL","08/10/2012","Flat Ground Floor 30 Colehill Lane London SW6 5EG","Erection of a single storey rear extension, to the side of the existing back addition, including ins...","Application Approved",""
"2012/02722/DET","08/10/2012","4 - 8 Effie Road London SW6 1TB","Submission of details of preliminary risk assessment report pursuant to Condition 28; details of sit...","Application Lapsed (No Further Action)",""
"2012/01993/DET","08/10/2012","4 - 8 Effie Road London SW6 1TB","Submission of details of temporary fencing pursuant to Condition 3 of conservation area consent ref....","Application Lapsed (No Further Action)",""
"2012/01836/DET","08/10/2012","4 - 8 Effie Road London SW6 1TB","Submission of details of contamination pursuant to conditions 28, 29 & 30 of planning permission ref...","Application Lapsed (No Further Action)",""
"2012/01835/DET","08/10/2012","4 - 8 Effie Road London SW6 1TB","Submission of details of demolition method statement pursuant to Condition 3 of planning permission ...","Application Lapsed (No Further Action)",""
"2012/03242/CLP","06/10/2012","15 Clifton Avenue London W12 9DR","Erection of a rear roof extension; installation of 3 x rooflights in the front roofslope.","Application Approved",""
"2012/03239/TREE","05/10/2012","33 Tamworth Street London SW6 1LF","Ivy removal and 30% crown reduction of sycamore in rear garden of 33 Tamworth Street. This is a tree...","Application Lapsed (No Further Action)",""
"2012/03238/TREE","05/10/2012","Sams Beauty Shop  616 Kings Road London SW6 2DU","Sole Sycamore in the rear garden of 616 Kings Road (The Beauty Boutique). Fell due to excessive shad...","Application Lapsed (No Further Action)",""
"2012/03237/TREE","05/10/2012","6 Micklethwaite Road London SW6 1QD","Rear Garden - Golden Acacia - Crown reduce to previous reduction points","Application Lapsed (No Further Action)",""
"2012/03262/FUL","04/10/2012","32 Sherbrooke Road London SW6 7HU","Erection of a rear extension at second floor level, over part of existing back addition.","Application Approved",""
"2012/03261/NMAT","04/10/2012","Hammersmith Embankment Site Known As 'Fulham Reach' Land Bound By Chancellor's Road, Distillery Road And Winslow Road, Including Sections Of Thames Path, Thames River, Frank Banfield Park, And Highway Land London W6","Non-Material Minor Amendment to planning permission ref: 2011/00407/COMB granted 23rd December 2011 ...","Application Approved",""
"2012/03258/CLP","04/10/2012","5 Lancaster Court Darlan Road London SW6 5TB","Use of part of the property as a private hire operating centre, on the basis that: (i) No other staf...","Application Approved",""
"2012/03229/FUL","04/10/2012","10 Harbledown Road London SW6 5TP","Erection of a single storey extension, to the side of the existing back addition.","Application Approved",""
"2012/03224/FUL","04/10/2012","15 Charleville Road London W14 9JJ","Erection of 1.1m high black metal railings enclosing the flat roof at first floor level.","Application Approved",""
"2012/03217/DET","04/10/2012","31 Woodstock Grove London W12 8LE","Submission of details of refuse and recyclables pursuant to Condition 11; details of cycle parking p...","Application Approved",""
"2012/03248/TREE","03/10/2012","32 Filmer Road London SW6 7JL","Rear garden. Bay, fell to ground level.","Application Lapsed (No Further Action)",""
"2012/03245/EFUL","03/10/2012","12 Netherwood Road London W14 0BJ","Renewal of Planning Permission 2009/02400/FUL granted 1st December 2009 for the erection of a hip to...","Application Approved",""
"2012/03215/FUL","03/10/2012","29 Palliser Road London W14 9EB","Demolition of existing enclosed balcony and stairs and replacement with black painted steel balcony ...","Application Approved",""
"2012/03214/FUL","03/10/2012","Stinging Nettle 55 Goldhawk Road London W12 8QP","Use of public highway as outdoor seating for 2 tables and 8 chairs in connection with the existing c...","Application Withdrawn",""
"2012/03212/FUL","03/10/2012","21 Favart Road London SW6 4AX","Excavation of part of the front, side and rear garden areas to form lightwells in connection with th...","Application Approved",""
"2012/03211/TREE","03/10/2012","38 Sedlescombe Road London SW6 1RD","Bay- Tree (shrub?) is in the left side of the rear garden adjacent to the area where we plan to exte...","Application Lapsed (No Further Action)",""
"2012/03208/FUL","03/10/2012","24 Bramber Road London W14 9PB","Erection of a single storey rear extension.","Application Approved",""
"2012/03329/TPO","02/10/2012","St Saviours Vicarage Cobbold Road London W12 9LN","Pruning of 1 x Holly Tree (T2) by reducing the height by 5-6m; pruning of 2 x Sycamore Trees (T5 and...","Application Approved",""
"2012/03203/FUL","02/10/2012","35 Hugon Road London SW6 3ER","Installation of new velux window into existing rear roof extension; erection of a rear extension at ...","Application Approved",""
"2012/03202/TREE","02/10/2012","9 Lord Napier Place London W6 9UB","Crown reduce 2 Holly trees by 33% in the rear garden. Reason: general maintenance to allow more ligh...","Application Lapsed (No Further Action)",""
"2012/03191/TREE","02/10/2012","47 Felden Street London SW6 5AE","Rear garden. 1) Mimosa, reduce and re-shape crown by 25%; clean our crown; remove deadwood. 2) Holly...","Application Lapsed (No Further Action)",""
"2012/03190/TREE","02/10/2012","1A Cloncurry Street London SW6 6DR","Rear garden. 1) False Acacia, fell to ground level by sectional takedown and treat stump to prevent ...","Application Lapsed (No Further Action)",""
"2012/03189/TREE","02/10/2012","54 Waldemar Avenue Mansions Waldemar Avenue London SW6 5LX","Removal of all trees on boundary line fronting Colehill Lane.","Application Lapsed (No Further Action)",""
"2012/03187/FUL","02/10/2012","787 Fulham Road London SW6 5HD","Erection of replacement canopy to front elevation.","Application Approved",""
"2012/03186/CLP","02/10/2012","26 Ellaline Road London W6 9NZ","Erection of a rear roof extension.","Application Refused",""
"2012/03221/LBC","01/10/2012","Olympia Exhibition Centre Hammersmith Road London W14 8UX","Installation of a new boiler flue at roof level; installation of one extract vent and one extract lo...","Application Approved",""
"2012/03220/FUL","01/10/2012","Olympia Exhibition Centre Hammersmith Road London W14 8UX","Installation of a new boiler flue at roof level; installation of one extract vent and one extract lo...","Application Approved",""
"2012/03216/FUL","01/10/2012","48 Cloncurry Street London SW6 6DU","Erection of a front and rear roof extension; erection of a rear extension at second floor level over...","Application Approved",""
"2012/03210/CLP","01/10/2012","1 Doria Road London SW6 4UF","Conversion of the property from 2 x self contained flats to a single dwelling house.","Application Approved",""
"2012/03207/FUL","01/10/2012","Maisonette B 60 Cranbury Road London SW6 2NJ","Replacement of existing windows at basement floor level to front elevation with sliding doors; insta...","Application Approved",""
"2012/03188/VAR","01/10/2012","264 North End Road London SW6 1NJ","Variation of condition 8 of planning permission ref: 2007/04342/FUL granted 8th September 2008 to al...","Application Approved",""
"2012/03181/FUL","01/10/2012","31 Sinclair Road London W14 0NS","Change of use of the entire building from office (Class B1) to residential (Class C3) to create 5x n...","Application Approved",""
"2012/03177/FUL","01/10/2012","1 Atalanta Street London SW6 6TU","Excavation of part of front and rear garden areas to form lightwells in connection with the creation...","Application Approved",""
"2012/03176/FUL","01/10/2012","2 Bridge Avenue London W6 9JP","External alterations to the building façade including installation of 3 x windows to the front eleva...","Application Approved",""
"2012/03175/FUL","01/10/2012","Flat Ground Floor 51 St Dionis Road London SW6 4UB","Erection of a single storey rear extension, to the side and rear of the existing back addition; exca...","Application Approved",""
"2012/03172/FUL","30/09/2012","20 Beltran Road London SW6 3AJ","Replacement of rooflight in existing rear roof extension with french doors and juliet balcony, erect...","Application Approved",""
"2012/03171/FUL","29/09/2012","121 Stevenage Road London SW6 6PA","Erection of a rear roof extension.","Application Approved",""
"2012/03184/FUL","28/09/2012","First Floor Union House 70 Shepherd's Bush Green London W12 8UA","Retention of an education and training college (Class D1) on the first floor.","Application Approved",""
"2012/03174/DET","28/09/2012","710 - 712 Fulham Road London SW6 5SB","Submission of details of cycle parking pursuant to condition 3; refuse storage pursuant to condition...","Application Approved",""
"2012/03168/ADV","28/09/2012","11 Bank Buildings Fulham Broadway London SW6 1ER","Continued display of mesh screen (16 metres high by 13.5 metres wide) attached to scaffolding on the...","Application Refused",""
"2012/03166/FUL","28/09/2012","100 Lakeside Road London W14 0DY","Installation of an enlarged timber sash window to replace the existing window at ground floor level ...","Application Approved",""
"2012/03165/LBC","28/09/2012","Northumberland House 134 New King's Road London SW6 4LZ","Amendment to Planning Permission 2011/03579/FUL and 2011/00016/LBC granted 9th March 2012 for the De...","Application Approved",""
