"2012/00862/FUL","14/03/2012","Units 20-21 West 12 Shopping Centre Shepherds Bush Green London  W12 8PH","Change of use from a hot food takeaway (Class A5) and restaurant (Class A3) to shop (Class A1) inclu...","Pending Decision",""
"2011/03944/DET","09/12/2011","49 - 68 Sulgrave Gardens London W6 7RB","Submission of details of typical bays of each building type pursuant to condition 25; details of no ...","Application Approved",""
"2011/03625/DET","09/11/2011","Imperial Wharf Townmead Road London","Submission of details of landscaping pursuant to condition 2; details of landscaping management purs...","Application Withdrawn",""
"2011/03593/VAR","04/11/2011","Block J2 Imperial Wharf Townmead Road London","Variation of Condition 11 of Planning Permission 2010/01187/FUL, granted 02 August 2011 to allow a m...","Application Withdrawn",""
"2011/03419/FUL","26/10/2011","70 - 72 Hammersmith Bridge Road London W6 9DB","Redevelopment of the site by the erection of a new part single / part two / part three / part four s...","Application Approved",""
"2011/03489/NMAT","24/10/2011","Imperial Wharf Townmead Road London","Non-Material Minor Amendment to Planning Permission 2010/01187/FUL granted 2nd August 2011 to add Co...","Application Withdrawn",""
"2011/03653/LBC","17/10/2011","Sacred Heart High School 212 Hammersmith Road London W6 7DG","Internal alterations associated with the use of former convent accommodation for educational use, in...","Application Approved",""
"2011/02850/ADV","08/09/2011","Network Rail Land C/o Latimer Road Westway London","Erection of a free-standing 32m high advertisement tower displaying two internally illuminated adver...","Application Refused",""
"2011/01824/LBC","13/06/2011","Fulham Cross School Munster Road London SW6 6AS","Replace double action doors on the internal staircase and communal corridors within the main school ...","Application Approved",""
"2011/01743/DET","03/06/2011","Block J1 Imperial Wharf Townmead Road London","Submission of detailed plans and details of the materials to be used in the construction of the hard...","Application Approved",""
"2011/01438/DET","16/05/2011","26 - 28 Hammersmith Grove London W6 7AW","Submission of details pursuant to Condition 11 (Contamination) of Planning Permission 2010/03389/FUL...","Application Approved",""
